[
  {
    "id": "lore-hack:abismo",
    "tipo": "lugar",
    "nome": "O Abismo",
    "descricao": "Queda monumental do Rio Ancestral no oeste; limiar de incursões demoníacas.",
    "aliases": [
      "O Abismo",
      "Abismo"
    ],
    "paginas": [
      5,
      6,
      8,
      9,
      14,
      21
    ],
    "origem": "fonte:hack-carcaca-dungeon-world-rascunho",
    "evidencia": "afirmado_no_rascunho",
    "integracao": "referencia_sem_mutar_canonico"
  },
  {
    "id": "lore-hack:abissais-marinhos",
    "tipo": "povo",
    "nome": "Abissais marinhos",
    "descricao": "Civilização anfíbia de profundezas, associada a Daegon, tributos, pactos e conquista; não são demônios do Abismo.",
    "aliases": [
      "Abissais"
    ],
    "paginas": [
      4,
      5,
      12,
      14,
      15,
      24
    ],
    "origem": "fonte:hack-carcaca-dungeon-world-rascunho",
    "evidencia": "afirmado_no_rascunho",
    "integracao": "referencia_sem_mutar_canonico"
  },
  {
    "id": "lore-hack:alquam",
    "tipo": "personagem",
    "nome": "Alquam",
    "descricao": "Senhor Demoníaco da Noite, ligado à invasão demoníaca e à extinção da luz.",
    "aliases": [
      "Alquam"
    ],
    "paginas": [
      8
    ],
    "origem": "fonte:hack-carcaca-dungeon-world-rascunho",
    "evidencia": "afirmado_no_rascunho",
    "integracao": "referencia_sem_mutar_canonico"
  },
  {
    "id": "lore-hack:annam",
    "tipo": "divindade",
    "nome": "Annam",
    "descricao": "Figura paterna do panteão gigante.",
    "aliases": [
      "Annam"
    ],
    "paginas": [
      22
    ],
    "origem": "fonte:hack-carcaca-dungeon-world-rascunho",
    "evidencia": "afirmado_no_rascunho",
    "integracao": "referencia_sem_mutar_canonico"
  },
  {
    "id": "lore-hack:anoes-thargrid",
    "tipo": "povo",
    "nome": "Anões de Thargrid",
    "descricao": "Clãs de galerias, forjas, provisões, engenharia e infraestrutura material da resistência.",
    "aliases": [
      "Anões de Thargrid",
      "anões"
    ],
    "paginas": [
      6,
      7,
      9,
      12,
      13,
      19,
      20,
      22
    ],
    "origem": "fonte:hack-carcaca-dungeon-world-rascunho",
    "evidencia": "afirmado_no_rascunho",
    "integracao": "referencia_sem_mutar_canonico"
  },
  {
    "id": "lore-hack:arquivo-mortos-afogados",
    "tipo": "lugar",
    "nome": "Arquivo dos Mortos Afogados",
    "descricao": "Biblioteca Yokai afogada associada à Gualápolis histórica.",
    "aliases": [
      "Arquivo dos Mortos Afogados"
    ],
    "paginas": [
      6,
      16
    ],
    "origem": "fonte:hack-carcaca-dungeon-world-rascunho",
    "evidencia": "afirmado_no_rascunho",
    "integracao": "referencia_sem_mutar_canonico"
  },
  {
    "id": "lore-hack:ateismo-arcano",
    "tipo": "conceito",
    "nome": "Ateísmo Arcano",
    "descricao": "Posição filosófica de magos que reconhecem a existência de deuses, mas negam-lhes autoridade automática.",
    "aliases": [
      "ATEÍSMO ARCANO"
    ],
    "paginas": [
      24,
      25
    ],
    "origem": "fonte:hack-carcaca-dungeon-world-rascunho",
    "evidencia": "afirmado_no_rascunho",
    "integracao": "referencia_sem_mutar_canonico"
  },
  {
    "id": "lore-hack:bahamut",
    "tipo": "divindade",
    "nome": "Bahamut",
    "descricao": "Divindade dracônica de justiça e proteção, referência religiosa transversal em Thargrid.",
    "aliases": [
      "Bahamut"
    ],
    "paginas": [
      22,
      23
    ],
    "origem": "fonte:hack-carcaca-dungeon-world-rascunho",
    "evidencia": "afirmado_no_rascunho",
    "integracao": "referencia_sem_mutar_canonico"
  },
  {
    "id": "lore-hack:bastet",
    "tipo": "divindade",
    "nome": "Bastet",
    "descricao": "Divindade popular em comunidades ribeirinhas do Rio Ancestral.",
    "aliases": [
      "Bastet"
    ],
    "paginas": [
      23,
      24
    ],
    "origem": "fonte:hack-carcaca-dungeon-world-rascunho",
    "evidencia": "afirmado_no_rascunho",
    "integracao": "referencia_sem_mutar_canonico"
  },
  {
    "id": "lore-hack:birka-uln-shayr",
    "tipo": "personagem",
    "nome": "Birka Uln-Shayr",
    "descricao": "Visconde da Casa Shayr associado à pressão familiar aristocrática sobre dissidência.",
    "aliases": [
      "Birka Uln-Shayr"
    ],
    "paginas": [
      6
    ],
    "origem": "fonte:hack-carcaca-dungeon-world-rascunho",
    "evidencia": "afirmado_no_rascunho",
    "integracao": "referencia_sem_mutar_canonico"
  },
  {
    "id": "lore-hack:boca-do-abismo",
    "tipo": "lugar",
    "nome": "Boca do Abismo",
    "descricao": "Fortaleza estabelecida por Ulorian na área de Gualápolis no contexto da defesa da foz.",
    "aliases": [
      "Boca do Abismo"
    ],
    "paginas": [
      6
    ],
    "origem": "fonte:hack-carcaca-dungeon-world-rascunho",
    "evidencia": "afirmado_no_rascunho",
    "integracao": "referencia_sem_mutar_canonico"
  },
  {
    "id": "lore-hack:caatinga",
    "tipo": "regiao",
    "nome": "Caatinga",
    "descricao": "Terras áridas de comunidades orcs, outros exilados e relações históricas de guerra e aliança com o litoral.",
    "aliases": [
      "Caatinga"
    ],
    "paginas": [
      5,
      9,
      12
    ],
    "origem": "fonte:hack-carcaca-dungeon-world-rascunho",
    "evidencia": "afirmado_no_rascunho",
    "integracao": "referencia_sem_mutar_canonico"
  },
  {
    "id": "lore-hack:carcaca",
    "tipo": "geografia",
    "nome": "Carcaça",
    "descricao": "Continente formado sobre o corpo fossilizado de Golzdov; ocupação colonial e resistência coexistem.",
    "aliases": [
      "Carcaça"
    ],
    "paginas": [
      2,
      3,
      4,
      5,
      6,
      7,
      8,
      9,
      11,
      12,
      14,
      15,
      16,
      17,
      18,
      19,
      20,
      21,
      22,
      23,
      24,
      25
    ],
    "origem": "fonte:hack-carcaca-dungeon-world-rascunho",
    "evidencia": "afirmado_no_rascunho",
    "integracao": "referencia_sem_mutar_canonico"
  },
  {
    "id": "lore-hack:casa-shayr",
    "tipo": "faccao",
    "nome": "Casa Shayr",
    "descricao": "Casa aristocrática feérica ligada a rotas, informação e ativos mágicos.",
    "aliases": [
      "Casa Shayr"
    ],
    "paginas": [
      6
    ],
    "origem": "fonte:hack-carcaca-dungeon-world-rascunho",
    "evidencia": "afirmado_no_rascunho",
    "integracao": "referencia_sem_mutar_canonico"
  },
  {
    "id": "lore-hack:confederacao-ossos",
    "tipo": "faccao",
    "nome": "Confederação dos Ossos",
    "descricao": "Aliança histórica contra ameaças externas, destruída no início das guerras de conquista feéricas.",
    "aliases": [
      "Confederação dos Ossos"
    ],
    "paginas": [
      9
    ],
    "origem": "fonte:hack-carcaca-dungeon-world-rascunho",
    "evidencia": "afirmado_no_rascunho",
    "integracao": "referencia_sem_mutar_canonico"
  },
  {
    "id": "lore-hack:corte-feerica",
    "tipo": "faccao",
    "nome": "Corte Feérica",
    "descricao": "Poder aristocrático shadow fey marcado por conspirações, tributação, controle colonial e rivalidades internas.",
    "aliases": [
      "Corte Feérica"
    ],
    "paginas": [
      7,
      9,
      15
    ],
    "origem": "fonte:hack-carcaca-dungeon-world-rascunho",
    "evidencia": "afirmado_no_rascunho",
    "integracao": "referencia_sem_mutar_canonico"
  },
  {
    "id": "lore-hack:costa-sul",
    "tipo": "regiao",
    "nome": "Costa Sul",
    "descricao": "Faixa marítima do Além Sul em contato com Portomonte, cavernas, ilhas e incursões rituais.",
    "aliases": [
      "Costa Sul"
    ],
    "paginas": [
      5,
      9,
      12,
      14,
      15,
      23
    ],
    "origem": "fonte:hack-carcaca-dungeon-world-rascunho",
    "evidencia": "afirmado_no_rascunho",
    "integracao": "referencia_sem_mutar_canonico"
  },
  {
    "id": "lore-hack:daegon",
    "tipo": "divindade",
    "nome": "Daegon",
    "descricao": "Deus das profundezas venerado por kuo-toa e abissais com culturas religiosas diferentes.",
    "aliases": [
      "Daegon"
    ],
    "paginas": [
      5,
      14,
      15,
      24
    ],
    "origem": "fonte:hack-carcaca-dungeon-world-rascunho",
    "evidencia": "afirmado_no_rascunho",
    "integracao": "referencia_sem_mutar_canonico"
  },
  {
    "id": "lore-hack:damaris-blackthorn",
    "tipo": "personagem",
    "nome": "Damaris Blackthorn",
    "descricao": "Lorde élfico sombrio que ocupa Vandar com exército de mortos-vivos.",
    "aliases": [
      "Damaris Blackthorn"
    ],
    "paginas": [
      5
    ],
    "origem": "fonte:hack-carcaca-dungeon-world-rascunho",
    "evidencia": "afirmado_no_rascunho",
    "integracao": "referencia_sem_mutar_canonico"
  },
  {
    "id": "lore-hack:demeter",
    "tipo": "divindade",
    "nome": "Deméter",
    "descricao": "Deusa vinculada ao templo de purificação das águas em Portomonte.",
    "aliases": [
      "Deméter"
    ],
    "paginas": [
      5,
      12,
      23,
      25
    ],
    "origem": "fonte:hack-carcaca-dungeon-world-rascunho",
    "evidencia": "afirmado_no_rascunho",
    "integracao": "referencia_sem_mutar_canonico"
  },
  {
    "id": "lore-hack:direito-de-nomear",
    "tipo": "conceito",
    "nome": "Direito de Nomear",
    "descricao": "Fundamento simbólico da legitimidade territorial associado à antiga escrita ritual Yokai.",
    "aliases": [
      "direito de nomear",
      "direito de nomeação"
    ],
    "paginas": [
      2,
      11
    ],
    "origem": "fonte:hack-carcaca-dungeon-world-rascunho",
    "evidencia": "afirmado_no_rascunho",
    "integracao": "referencia_sem_mutar_canonico"
  },
  {
    "id": "lore-hack:draconatos-thargrid",
    "tipo": "povo",
    "nome": "Draconatos de Thargrid",
    "descricao": "Clãs de honra, juramentos, mediação política, passagens e defesa montanhosa.",
    "aliases": [
      "Draconatos de Thargrid",
      "draconatos"
    ],
    "paginas": [
      13,
      22,
      23
    ],
    "origem": "fonte:hack-carcaca-dungeon-world-rascunho",